{
  "run_id": "42-plan-1",
  "role": "coordinator",
  "status": "completed",
  "summary": "План из двух шагов на основе bugfix: исправление и проверка.",
  "plan": {
    "task_id": 42,
    "version": 1,
    "basis": "playbooks/bugfix.md",
    "reason": "Изменение в одном сервисе, требования понятны из задачи.",
    "steps": [
      {
        "id": "fix",
        "type": "role",
        "role": "go-developer",
        "command": "fix",
        "text": "Возвращать код и сообщение провайдера в теле ответа при отказе платежа.",
        "refs": ["gitlab:payments-and-transfers/pat_online_payment_service"]
      },
      {
        "id": "verify",
        "type": "role",
        "role": "qa-engineer",
        "command": "verify",
        "text": "Проверить MR по критериям из PAT-42.",
        "after": ["fix"]
      }
    ]
  }
}
